{
  "schema_version": "0.1.0",
  "twin_id": "SYNTHETIC_TWIN_001",
  "state_version": 1,
  "as_of": "2026-09-01T10:00:00Z",
  "event_ids": [
    "evt_demo_001"
  ],
  "data_version": "synthetic-0.1.0",
  "values": {
    "tumour_size_mm": 31,
    "grade": 2,
    "positive_nodes": 3,
    "her2_status": null
  },
  "missing_fields": [
    "her2_status"
  ],
  "quality_warnings": [
    "Synthetic fixture; HER2 status is missing."
  ]
}
